{
  "schemaVersion": "1.0",
  "geradoPor": "fixture (painel aprovado)",
  "vaga": {
    "id": "nexora-analista-rh-2026-10-20",
    "titulo": "Analista de Recursos Humanos — Nexora Soluções Empresariais",
    "cargo": "Analista de Recursos Humanos",
    "empresa": "Nexora Soluções Empresariais",
    "area": "Gente & Gestão | Recursos Humanos",
    "local": "São Paulo, SP",
    "modelo": "hibrido",
    "contrato": "CLT · integral",
    "faixa": "R$ 3.800–5.200",
    "data": "2026-10-20",
    "exigePresenca": true,
    "afirmativa": "",
    "fonteRequisitos": "Requisitos tirados do anúncio da Nexora."
  },
  "criterios": [
    {
      "id": "C1",
      "nome": "Graduação em Administração, Psicologia, Gestão de RH ou correlata",
      "tipo": "O",
      "peso": 10
    },
    {
      "id": "C2",
      "nome": "Mínimo 2 anos em RH (tempo, nível e recência)",
      "tipo": "O",
      "peso": 15
    },
    {
      "id": "C3",
      "nome": "Excel intermediário (tabela dinâmica, gráficos, fórmulas)",
      "tipo": "O",
      "peso": 10
    },
    {
      "id": "C4",
      "nome": "R&S com condução de entrevistas por competências",
      "tipo": "O",
      "peso": 20
    },
    {
      "id": "C5",
      "nome": "Vivência em LNT e aplicação de treinamentos",
      "tipo": "O",
      "peso": 15
    },
    {
      "id": "C6",
      "nome": "Pós/MBA em Gestão de Pessoas, RH Estratégico ou afins",
      "tipo": "D",
      "peso": 5
    },
    {
      "id": "C7",
      "nome": "DISC, MBTI ou mapeamento comportamental",
      "tipo": "D",
      "peso": 4
    },
    {
      "id": "C8",
      "nome": "ATS (LinkedIn Recruiter, Gupy, Kenoby ou similar)",
      "tipo": "D",
      "peso": 4
    },
    {
      "id": "C9",
      "nome": "Inglês intermediário",
      "tipo": "D",
      "peso": 4
    },
    {
      "id": "C10",
      "nome": "Certificação em coaching ou gestão de conflitos",
      "tipo": "D",
      "peso": 3
    },
    {
      "id": "C11",
      "nome": "OKRs aplicados a RH",
      "tipo": "D",
      "peso": 2
    },
    {
      "id": "C12",
      "nome": "Responsabilidades da vaga: clima, indicadores, desempenho, desligamento",
      "tipo": "D",
      "peso": 8
    }
  ],
  "candidatos": [
    {
      "id": "juliana",
      "nome": "Juliana Ferreira Costa",
      "arquivo": "01_curriculo_juliana_ferreira_costa.pdf",
      "cidade": "São Paulo, SP",
      "cargo": "Analista de RH Sênior · Groupe Solaris Cosméticos",
      "status": "aprovado",
      "ordemRecencia": 1,
      "notas": {
        "C1": {
          "nota": 5,
          "trecho": "Bacharelado em Psicologia — Universidade Mackenzie — 2018",
          "natureza": "escrito"
        },
        "C2": {
          "nota": 5,
          "trecho": "Analista de RH Sênior … Jan/2021 – Atual; Assistente de RH … Mar/2018 – Dez/2020",
          "natureza": "escrito"
        },
        "C3": {
          "nota": 4,
          "trecho": "Excel Avançado (declarado) + Controle e análise de indicadores: turnover, absenteísmo, headcount",
          "natureza": "escrito"
        },
        "C4": {
          "nota": 4,
          "trecho": "Coordenação de 40+ processos seletivos/ano (analista a gerência)",
          "natureza": "escrito",
          "comentario": "método por competências não citado"
        },
        "C5": {
          "nota": 4,
          "trecho": "Apoio em treinamentos e aplicação de LNT (2018–2020) + Desenvolvimento de programa de onboarding",
          "natureza": "escrito"
        },
        "C6": {
          "nota": 5,
          "trecho": "MBA em Gestão de Pessoas — FIA Business School — 2022",
          "natureza": "escrito"
        },
        "C7": {
          "nota": 5,
          "trecho": "Certificação DISC Analyst — The Predictive Index (2022)",
          "natureza": "escrito"
        },
        "C8": {
          "nota": 3,
          "trecho": "Gupy (ATS)",
          "natureza": "declarado",
          "comentario": "só na lista de habilidades: declarada, não evidenciada"
        },
        "C9": {
          "nota": 4,
          "trecho": "Inglês: Intermediário",
          "natureza": "escrito",
          "comentario": "autodeclarado"
        },
        "C10": {
          "nota": 0,
          "trecho": "Sem menção",
          "natureza": "ausente"
        },
        "C11": {
          "nota": 0,
          "trecho": "Sem menção",
          "natureza": "ausente"
        },
        "C12": {
          "nota": 4,
          "trecho": "Implantação de pesquisa de clima com 87% de adesão; onboarding; indicadores",
          "natureza": "escrito",
          "comentario": "sem desempenho/desligamento"
        }
      },
      "fortes": [
        {
          "texto": "R&S em volume e em vários níveis",
          "trecho": "Coordenação de 40+ processos seletivos/ano (analista a gerência)"
        },
        {
          "texto": "Clima com resultado mensurado",
          "trecho": "Implantação de pesquisa de clima com 87% de adesão"
        },
        {
          "texto": "Onboarding e indicadores com número",
          "trecho": "Desenvolvimento de programa de onboarding — redução de 30% no tempo de integração"
        }
      ],
      "riscos": [
        {
          "texto": "LNT e treinamentos só aparecem no cargo de assistente (2018–2020); não há evidência recente de T&D",
          "trecho": "Apoio em treinamentos e aplicação de LNT",
          "inferencia": false
        },
        {
          "texto": "Título Sênior contra faixa de R$ 3.800–5.200 do anúncio: risco de desalinhamento de expectativa salarial (inferência, o CV não traz salário)",
          "trecho": "Analista de RH Sênior",
          "inferencia": true
        }
      ],
      "inconsistencias": [
        {
          "texto": "Salto de Assistente (Dez/2020) para Analista Sênior (Jan/2021) com troca de empresa: validar escopo real do cargo.",
          "inferencia": false
        },
        {
          "texto": "30% de redução no tempo de integração e 87% de adesão sem base (de quanto para quanto, quantas pessoas).",
          "inferencia": false
        },
        {
          "texto": "Coordenar 40+ processos não diz se ela conduzia as entrevistas nem o método.",
          "inferencia": false
        },
        {
          "texto": "Certificação DISC emitida por The Predictive Index: o PI tem metodologia própria, diferente do DISC (inferência minha). Pedir o certificado.",
          "inferencia": true
        }
      ]
    },
    {
      "id": "anderson",
      "nome": "Anderson Costa Ferreira",
      "arquivo": "07_curriculo_anderson_costa_ferreira.pdf",
      "cidade": "Osasco, SP",
      "cargo": "Analista de RH · Supermercados Bom Preço (até Nov/2022)",
      "status": "aprovado",
      "ordemRecencia": 5,
      "notas": {
        "C1": {
          "nota": 5,
          "trecho": "Bacharelado em Administração — Universidade Metodista de São Paulo — 2015",
          "natureza": "escrito"
        },
        "C2": {
          "nota": 4,
          "trecho": "Analista de RH … Fev/2016 – Nov/2022",
          "natureza": "escrito",
          "comentario": "sem atuação em RH registrada desde Nov/2022"
        },
        "C3": {
          "nota": 4,
          "trecho": "Excel Avançado + Elaboração de relatórios de turnover e absenteísmo para a diretoria",
          "natureza": "escrito"
        },
        "C4": {
          "nota": 4,
          "trecho": "Recrutamento e seleção para 12 lojas (operacional, supervisão e coordenação)",
          "natureza": "escrito",
          "comentario": "método não citado"
        },
        "C5": {
          "nota": 2,
          "trecho": "7 anos de experiência em R&S, T&D (objetivo)",
          "natureza": "declarado",
          "comentario": "nenhum item de LNT ou treinamento nas experiências: declarada, não evidenciada"
        },
        "C6": {
          "nota": 5,
          "trecho": "Especialização em Gestão de Pessoas — SENAC — 2017 — 360 horas",
          "natureza": "escrito"
        },
        "C7": {
          "nota": 0,
          "trecho": "Sem menção",
          "natureza": "ausente"
        },
        "C8": {
          "nota": 3,
          "trecho": "Gupy",
          "natureza": "declarado",
          "comentario": "só na lista de habilidades: declarada, não evidenciada"
        },
        "C9": {
          "nota": 1,
          "trecho": "Inglês: Básico",
          "natureza": "escrito"
        },
        "C10": {
          "nota": 5,
          "trecho": "Coaching Executivo — ICF (International Coaching Federation, 2024)",
          "natureza": "escrito"
        },
        "C11": {
          "nota": 0,
          "trecho": "Sem menção",
          "natureza": "ausente"
        },
        "C12": {
          "nota": 4,
          "trecho": "Aplicação e análise de avaliações de desempenho semestrais; relatórios de turnover e absenteísmo",
          "natureza": "escrito"
        }
      },
      "fortes": [
        {
          "texto": "R&S multinível em operação de varejo",
          "trecho": "Recrutamento e seleção para 12 lojas (operacional, supervisão e coordenação)"
        },
        {
          "texto": "Indicadores levados à diretoria",
          "trecho": "Elaboração de relatórios de turnover e absenteísmo para a diretoria"
        },
        {
          "texto": "Desempenho e programa estruturado",
          "trecho": "Aplicação e análise de avaliações de desempenho semestrais; Gestão do programa de jovem aprendiz (80 jovens/ciclo)"
        }
      ],
      "riscos": [
        {
          "texto": "T&D aparece só no título e no objetivo; nenhuma experiência descreve LNT ou treinamento aplicado",
          "trecho": "7 anos de experiência em R&S, T&D",
          "inferencia": false
        },
        {
          "texto": "Recência: último cargo em RH terminou em Nov/2022 e o CV não descreve atividade de Jan/2025 até hoje",
          "trecho": "Período Sabático | Nov/2022 – Dez/2024",
          "inferencia": false
        }
      ],